,title,order,body,A,B,C,D,E,resposta,resolucao
36,ENEM2023LIN33: ,37,"<div class=""dangerous-html""><p>&nbsp;&nbsp;&nbsp;&nbsp;Mandioca, macaxeira, aipim e castelinha são nomes diferentes da mesma planta. Semáforo, sinaleiro e farol também significam a mesma coisa. O que muda é só o hábito cultural de cada região. A mesma coisa acontece com a Língua Brasileira de Sinais (Libras). Embora ela seja a comunicação oficial da comunidade surda no Brasil, existem sinais que variam em relação à região, à idade e até ao gênero de quem se comunica. A cor verde, por exemplo, possui sinais diferentes no Rio de Janeiro, Paraná e São Paulo. São os regionalismos na língua de sinais.<br>&nbsp;&nbsp;&nbsp;&nbsp;Essas variações são um dos temas da disciplina Linguística na língua de sinais, oferecida pela Universidade Estadual Paulista (Unesp) ao longo do segundo semestre. ""Muitas pessoas pensam que a língua de sinais é universal, o que não é verdade"", explica a professora e chefe do Departamento de Linguística, Literatura e Letras Clássicas da Unesp. ""Mesmo dentro de um mesmo país, ela sofre variação em relação à localização geográfica, à faixa etária e até ao gênero dos usuários"", completa a especialista.<br>&nbsp;&nbsp;&nbsp;&nbsp;Os surdos podem criar sinais diferentes para identificar lugares, objetos e conceitos. Em São Paulo, o sinal de ""cerveja"" é feito com um giro do punho como uma meia-volta. Em Minas, a bebida é citada quando os dedos indicador e médio batem no lado do rosto. Também ocorrem mudanças históricas. Um sinal pode sofrer alterações decorrentes dos costumes da geração que o utiliza.</p><p style=""text-align:right""><span>Disponível em: www.educacao.sp.gov.br. Acesso em: 1 nov. 2021 (adaptado).</span></p><p><br></p><p>Nesse texto, a Língua Brasileira de Sinais (Libras)</p></div>","<div class=""exercise-answer__content dangerous-html"">passa por fenômenos de variação linguística como qualquer outra língua.</div>","<div class=""exercise-answer__content dangerous-html"">apresenta variações regionais, assumindo novo sentido para algumas palavras.</div>","<div class=""exercise-answer__content dangerous-html"">sofre mudança estrutural motivada pelo uso de sinais diferentes para algumas palavras.</div>","<div class=""exercise-answer__content dangerous-html"">diferencia-se em todo o Brasil, desenvolvendo cada região a sua própria língua de sinais.</div>","<div class=""exercise-answer__content dangerous-html"">é ininteligível para parte dos usuários em razão das mudanças de sinais motivadas geograficamente.</div>",A,"<div class=""dangerous-html""><p><br></p></div>"
37,ENEM2023LIN34: ,39,"<div class=""dangerous-html""><p>&nbsp;&nbsp;&nbsp;&nbsp;Como é bom reencontrar os leitores da Revista da Cultura por meio de uma publicação com outro visual, conteúdo de qualidade e interesses ampliados! Jcultural, este nome simples, e eu diria mesmo familiar, nasce entre dois colchetes voltados para fora. E não é por acaso: são sinais abertos, receptivos, propícios à circulação de ideias. O DNA da publicação se mantém o mesmo, afinal, por longos anos montamos nossas edições com assuntos saídos das estantes de uma grande livraria - e assim continuará sendo. Literatura, sociologia, filosofia, artes... nunca será difícil montar a pauta da revista porque os livros nos ensinam que monotonia é só para quem não lê.</p><p style=""text-align:right""><span>HERZ, P. Jcultura[, n. 1, jun. 2018 (adaptado).</span></p><p>O uso não padrão dos colchetes para nomear a revista atribui-lhes uma nova função e está correlacionado ao(à)</p></div>","<div class=""exercise-answer__content dangerous-html"">perfil de público-alvo, constituído por leitores exigentes e especializados em leitura acadêmica.</div>","<div class=""exercise-answer__content dangerous-html"">propósito do editor, chamando a atenção para o rigor normativo nos textos da revista.</div>","<div class=""exercise-answer__content dangerous-html"">exclusividade na seleção temática, direcionada para a área das ciências humanas.</div>","<div class=""exercise-answer__content dangerous-html"">identidade da revista, voltada para a recepção e a promoção de ideias circulantes em livros.</div>","<div class=""exercise-answer__content dangerous-html""><div>padrão editorial dos artigos, organizados em torno de uma proposta de design inovador.</div><div><br></div></div>",D,"<div class=""dangerous-html""><p><br></p></div>"
38,"ENEM2023LIN35: TEXTO IAlegria, alegriaO sol na",40,"<div class=""dangerous-html""><p style=""text-align:left""><strong>TEXTO I<br></strong></p><div style=""text-align:center""><strong>Alegria, alegria</strong></div><div style=""text-align:left""><strong><br></strong>O sol nas bancas de revista<br>Me enche de alegria e preguiça<br>Quem lê tanta notícia<br>Eu vou<br>Por entre fotos e nomes<br>Os olhos cheios de cores<br>O peito cheio de amores vãos<br>Eu vou<br>Por que não, por que não?</div><p style=""text-align:right""><span>VELOSO, C. Alegria, alegria. Rio de Janeiro: Polygram, 1990 (fragmento).</span></p><p><strong>TEXTO II</strong></p><p style=""text-align:center""><strong>Anjos tronchos</strong></p><p>Uns anjos tronchos do Vale do Silício<br>Desses que vivem no escuro em plena luz<br>Disseram vai ser virtuoso no vício<br>Das telas dos azuis mais do que azuis</p><p>Agora a minha história é um denso algoritmo<br>Que vende venda a vendedores reais<br>Neurônios meus ganharam novo outro ritmo<br>E mais, e mais, e mais, e mais, e mais</p><p><br></p><p style=""text-align:right""><span>VELOSO, C. Meu coco. Rio de Janeiro: Sony, 2021 (fragmento</span></p><p style=""text-align:right""><br></p><p>Embora oriundas de momentos históricos diferentes, essas letras de canção têm em comum a</p></div>","<div class=""exercise-answer__content dangerous-html"">referência às cores como elemento de crítica a hábitos contemporâneos.</div>","<div class=""exercise-answer__content dangerous-html"">percepção da profusão de informações gerada pela tecnologia.</div>","<div class=""exercise-answer__content dangerous-html"">contraposição entre os vícios e as virtudes da vida moderna.</div>","<div class=""exercise-answer__content dangerous-html"">busca constante pela liberdade de expressão individual</div>","<div class=""exercise-answer__content dangerous-html"">crítica à finalidade comercial das notícias.</div>",B,"<div class=""dangerous-html""><p><br></p></div>"
39,ENEM2023LIN36: Dão Lalalão,41,"<div class=""dangerous-html""><p style=""text-align:center""><strong>Dão Lalalão</strong></p><p style=""text-align:center"">&nbsp;&nbsp;&nbsp;&nbsp;<br></p><div style=""text-align:justify""><strong>&nbsp; &nbsp;</strong>&nbsp;<span style=""text-align:left"">Do povoado do Ão, ou dos sítios perto, alguém precisava urgente de querer vir por escutar a novela do rádio. Ouvia-a, aprendia-a, guardava na ideia, e, retornado ao Ão, no dia seguinte, a repetia a outros.<br></span>&nbsp;&nbsp;&nbsp;&nbsp;<span style=""text-align:left"">Assim estavam jantando, vinham os do povoado receber a nova parte da novela do rádio. Ouvir já tinham ouvido tudo, de uma vez, fugia da regra: falhara ali no Ão, na véspera, o caminhão de um comprador de galinhas e ovos, seo Abrãozinho Buristém, que carregava um rádio pequeno, de pilhas, armara um fio no arame da cerca... Mas queriam escutar outra vez, por confirmação. ""A estória é estável de boa, mal que acompridada: taca e não rende..."". explicava o Zuz ao Dalberto.<br></span>&nbsp;&nbsp;&nbsp;&nbsp;<span style=""text-align:left"">Soropita começou a recontar o capítulo da novela. Sem trabalho, se recordava das palavras, até com clareza - disso se admirava. Contava com prazer de demorar, encher a sala com o poder de outros altos personagens. Tomar a atenção de todos, pudesse contar aquilo noite adiante. Era preciso trazer luz, nem uns enxergavam mais os outros; quando alguém ria, ria de muito longe. O capítulo da novela estava terminando.</span></div><p></p><p style=""text-align:right""><span>ROSA, JG. Noites do sertão (Corpo de baile). São Paulo: Global, 2021.</span></p><p>Nesse trecho do conto, o gosto dos moradores do povoado por ouvir a novela de rádio recontada por Soropita deve-se ao(à)</p></div>","<div class=""exercise-answer__content dangerous-html"">qualidade do som do rádio.</div>","<div class=""exercise-answer__content dangerous-html"">estabilidade do enredo contado.</div>","<div class=""exercise-answer__content dangerous-html"">ineditismo do capítulo da novela.</div>","<div class=""exercise-answer__content dangerous-html"">jeito singular de falar aos ouvintes.</div>","<div class=""exercise-answer__content dangerous-html"">dificuldade de compreensão da história</div>",D,"<div class=""dangerous-html""><p><br></p></div>"
40,ENEM2023LIN37: ,42,"<div class=""dangerous-html""><p></p><div style=""text-align:justify"">&nbsp; &nbsp; As cinzas do Museu Nacional, no Rio de Janeiro, consumido pelas chamas no mês de setembro de 2018, são mais do que restos de fósseis, cerâmicas e espécimes raros. O museu abrigava, entre mais de 20 milhões de peças, os esqueletos com as respostas para perguntas que ainda não haviam sido respondidas - ou sequer feitas - por pesquisadores brasileiros. E o incêndio pode ter calado para sempre palavras e cantos indígenas ancestrais, de línguas que não existem mais no mundo.</div><div style=""text-align:justify"">&nbsp; &nbsp; O acervo do local continha gravações de conversas, cantos e rituais de dezenas de sociedades indígenas, muitas feitas durante a década de 1960 com antigos gravadores de rolo e que ainda não haviam sido digitalizadas. Alguns dos registros abordavam línguas já extintas, sem falantes originais ainda vivos. ""A esperança é que outras instituições tenham registros dessas linguas"", diz a linguista Marilia Facó Soares. A pesquisadora, que trabalha com os índios Tikuna, o maior grupo da Amazônia brasileira, crê ter perdido parte de seu material. ""Terei que fazer novas viagens de campo para recompor meus arquivos. Mas obviamente não dá para recuperar a fala de nativos já falecidos, geralmente os mais idosos"", lamenta.</div><p></p><p><br></p><p style=""text-align:right""><span>Disponível em: https://brasil.elpais.com. Acesso em: 10 dez. 2018 (adaptado).</span></p><p>A perda dos registros linguísticos no incêndio do Museu Nacional tem impacto potencializado, uma vez que</p></div>","<div class=""exercise-answer__content dangerous-html"">exige a retomada das pesquisas por especialistas de diferentes áreas.</div>","<div class=""exercise-answer__content dangerous-html"">representa danos irreparáveis à memória e à identidade nacionais.</div>","<div class=""exercise-answer__content dangerous-html"">impossibilita o surgimento de novas pesquisas na área.</div>","<div class=""exercise-answer__content dangerous-html"">resulta na extinção da cultura de povos originários.</div>","<div class=""exercise-answer__content dangerous-html"">inviabiliza o estudo da língua do povo Tikuna.</div>",B,"<div class=""dangerous-html""><p><br></p></div>"
41,ENEM2023LIN38: ,43,"<div class=""dangerous-html""><p style=""text-align:justify"">&nbsp;&nbsp;&nbsp;&nbsp;Na Idade Média, as notícias se propagavam com surpreendente eficácia. Segundo uma emérita professora de Sorbonne, um cavalo era capaz de percorrer 30 quilômetros por dia, mas o tempo podia se acelerar dependendo do interesse da notícia. As ordens mendicantes tinham um papel importante na disseminação de informações, assim como os jograis, os peregrinos e os vagabundos, porque todos eles percorriam grandes distâncias. As cidades também tinham correios organizados e selos para lacrar mensagens e tentar certificar a veracidade das correspondências. Graças a tudo isso, a circulação de boatos era intensa e politicamente relevante. Um exemplo clássico de <i>fake news</i> da era medieval é a história do rei que desaparece na batalha e reaparece muito depois, idoso e transformado.</p><p style=""text-align:justify""><br></p><p style=""text-align:right""><span>Disponível em: www.elpais.com.br. Acesso em: 18 jun. 2018 (adaptado).</span></p><p>A propagação sistemática de informações é um fenômeno recorrente na história e no desenvolvimento das sociedades. No texto, a eficácia dessa propagação está diretamente relacionada ao(à)</p></div>","<div class=""exercise-answer__content dangerous-html"">velocidade de circulação das notícias.</div>","<div class=""exercise-answer__content dangerous-html"">nível de letramento da população marginalizada.</div>","<div class=""exercise-answer__content dangerous-html"">poder de censura por parte dos serviços públicos.</div>","<div class=""exercise-answer__content dangerous-html"">legitimidade da voz dos representantes da nobreza.</div>","<div class=""exercise-answer__content dangerous-html"">diversidade dos meios disponíveis em uma época histórica.</div>",E,"<div class=""dangerous-html""><p>O enunciado exige do candidato a relação direta que se estabelece com a eficácia da propagação de informações na Idade Média. No próprio texto, o candidato acharia, de forma explícita, referências às ordens mendicantes e aos sistemas organizados de correios que as cidades já possuíam naquela época.<br></p></div>"
42,ENEM2023LIN39: ,44,"<div class=""dangerous-html""><p></p><div style=""text-align:justify"">&nbsp; &nbsp; Se a interferência de contas falsas em discussões políticas nas redes sociais já representava um perigo para os sistemas democráticos, sua sofisticação e maior semelhança com pessoas reais têm agravado o problema pelo mundo.</div><div style=""text-align:justify"">&nbsp; &nbsp; O perigo cresceu porque a tecnologia e os métodos evoluíram dos robôs, os ""<i>bots</i>""- softwares com tarefas on-line automatizadas, para os ""ciborgues"" ou ""<i>trolls</i>"", contas controladas diretamente por humanos com ajuda de um pouco de automação.</div><div style=""text-align:justify"">&nbsp; &nbsp; Mas pesquisadores começam agora a observar outros padrões de comportamento: quando mensagens não são programadas, sua publicação se concentra só em horários de trabalho, já que é controlada por pessoas cuja profissão é exatamente essa, administrar um perfil falso durante o dia.</div><div style=""text-align:justify"">&nbsp; &nbsp; Outra pista: a pobreza vocabular das mensagens publicadas por esses perfis. Um funcionário de uma empresa que supostamente produzia e vendia perfis falsos explica que às vezes ""faltava criatividade"" para criar mensagens distintas controlando tantos perfis falsos ao mesmo tempo.</div><p></p><p style=""text-align:right""><span>GRAGNANI, J. Disponível em: www.bbc.com. Acesso em: 16 dez. 2017</span></p><p>De acordo com texto, a análise de características da linguagem empregada por perfis automatizados contribui para o(a)</p></div>","<div class=""exercise-answer__content dangerous-html"">controle da atuação dos profissionais de TI.</div>","<div class=""exercise-answer__content dangerous-html"">desenvolvimento de tecnologias como os ""<i>trolls</i>"".</div>","<div class=""exercise-answer__content dangerous-html"">&nbsp;flexibilização dos turnos de trabalho dos controladores.</div>","<div class=""exercise-answer__content dangerous-html"">necessidade de regulamentação do funcionamento dos ""<i>bots</i>"".</div>","<div class=""exercise-answer__content dangerous-html"">identificação de padrões de disseminação de informações inverídicas.</div>",E,"<div class=""dangerous-html"">Considerando o fato de os pesquisadores terem identificado padrões comportamentais (horários pré-fixados) e linguísticos (pobreza vocabular) na disseminação de informações falsas por ""<i>bots</i>"" ou ""<i>trolls</i>"", o único item pertinente passa a ser a opção E.</div>"
43,ENEM2023LIN40: ,45,"<div class=""dangerous-html""><p></p><div style=""text-align:justify"">&nbsp; &nbsp; Maio foi colorido de amarelo, e o foi porque mundialmente amarelo é a cor convencionada para as advertências. No trânsito, essas advertências têm sido fatais. A estimativa, caso nada seja feito, é a de que se atinjam assustadoras 2,4 milhões de mortes no trânsito em 2030 em todo o mundo.</div><div style=""text-align:justify"">&nbsp; &nbsp; A pressa constante, o sentimento de invencibilidade, a certeza de invulnerabilidade, a necessidade de poder, a falta de civilidade, a certeza de impunidade, a ausência de solidariedade, a inexistência de compaixão e o desrespeito por si próprio são circunstâncias reais que, não raro, concorrem para o comportamento violento no trânsito.</div><div style=""text-align:justify"">&nbsp; &nbsp; O Maio Amarelo, que preconiza a atenção pela vida, é uma das iniciativas nesse sentido. E é precisamente a atenção pela vida que está esquecida. Essa atenção, por certo, requer menos pressa, mais civilidade, limites assegurados, consciência de vulnerabilidade, solidariedade, compaixão e respeito por si e pelo outro. Reafirmar e praticar esses princípios e valores talvez seja um caminho mais seguro e menos violento, que garanta a vida e não celebre a morte.</div><p></p><p style=""text-align:right""><span>Disponível em: http://portaldotransito.com.br. Acesso em: 11 dez. 2018 (adaptado).</span></p><p>Considerando OS procedimentos argumentativos utilizados, infere-se que o objetivo desse texto é</p></div>","<div class=""exercise-answer__content dangerous-html"">enumerar as causas determinantes da violência no trânsito.</div>","<div class=""exercise-answer__content dangerous-html""><div>contextualizar a campanha de advertência no cenário mundial.</div><div><br></div></div>","<div class=""exercise-answer__content dangerous-html"">divulgar dados numéricos alarmantes sobre acidentes de trânsito.</div>","<div class=""exercise-answer__content dangerous-html""><div>sensibilizar o público para a importância de uma direção responsável.</div><div><br></div></div>","<div class=""exercise-answer__content dangerous-html"">E restringir os problemas da violência no trânsito a aspectos emocionais.</div>",D,"<div class=""dangerous-html"">O texto aborda o tema da violência no trânsito, mesmo em perspectiva futura (2030), mas atribui o fato a uma série de circunstâncias reais que seriam culpadas por isso. Assim, o ""amarelo"" passaria a simbolizar a importância de uma direção mais responsável na proteção da vida.</div>"
44,ENEM2023LIN41: ,46,"<div class=""dangerous-html""><p style=""text-align:justify"">&nbsp;&nbsp;&nbsp;&nbsp;A sessão do Comitê Olímpico Internacional (COI) aprovou uma mudança histórica e inédita no lema olímpico, criado em 1894 pelo Barão Pierre de Coubertin para expressar os valores e a excelência do esporte. Mais de 120 anos depois, o lema tem sua primeira alteração para ressaltar a solidariedade e incluir a palavra ""juntos"": mais rápido, mais alto, mais forte - juntos. A mudança foi aprovada por unanimidade pelos membros do COI e celebrada pelo presidente da entidade.</p><p style=""text-align:right""><span>Disponível em: https://ge.globo.comAcesso em: 10 nov. 2021 (adaptado).</span></p><p>De acordo com o texto, a alteração do lema olímpico teve como objetivo a</p></div>","<div class=""exercise-answer__content dangerous-html"">unificação do lema anterior ao atual.</div>","<div class=""exercise-answer__content dangerous-html""><div>aproximação entre o lema olímpico e o COI.</div><div><br></div></div>","<div class=""exercise-answer__content dangerous-html"">junção do lema olímpico com os princípios esportivos.</div>","<div class=""exercise-answer__content dangerous-html"">associação entre o lema olímpico e a cooperatividade.</div>","<div class=""exercise-answer__content dangerous-html"">vinculação entre o lema olímpico e os eventos atléticos.</div>",D,"<div class=""dangerous-html""><p><br></p></div>"
45,ENEM2023LIN42: Mais iluminada que outras,47,"<div class=""dangerous-html""><p style=""text-align:center""><strong>Mais iluminada que outras</strong></p><p></p><div style=""text-align:justify"">&nbsp; &nbsp; Tenho dois seios, estas duas coxas, duas mãos que me são muito úteis, olhos escuros, estas duas sobrancelhas que preencho com maquiagem comprada por dezenove e noventa e orelhas que não aceitam bijuterias. Este corpo é um corpo faminto, dentado, cruel, capaz e violento. Movo os braços e multidões correm desesperadas. Caminho no escuro com o rosto para baixo, pois cada parte isolada de mim tem sua própria vida e não quero domá-las. Animal da caatinga. Forte demais. Engolidora de espadas e espinhos.</div><div style=""text-align:justify"">&nbsp; &nbsp; Dizem e eu ouvi, mas depois também li, que o estado do Ceará aboliu a escravidão quatro anos antes do restante do país. Todos aqueles corpos que eram trazidos com seus dedos contados, seus calcanhares prontos e seus umbigos em fogo, todos eles foram interrompidos no porto. Um homem - dizem e eu ouvi e depois também li - liderou o levante. E todos esses corpos foram buscar outros incômodos. Foram ser incomodados.</div><p></p><p style=""text-align:right""><span>ARRAES, J. Redemoinho em dia quente. São Paulo: Alfaguara, 2019.</span></p><p>Nesse texto, os recursos expressivos usados pela narradora<br></p></div>","<div class=""exercise-answer__content dangerous-html"">revelam as marcas da violência de raça e de gênero na construção da identidade.</div>","<div class=""exercise-answer__content dangerous-html"">questionam o pioneirismo do estado do Ceará no enfrentamento à escravidão.</div>","<div class=""exercise-answer__content dangerous-html"">reproduzem padrões estéticos em busca da valorização da autoestima feminina.</div>","<div class=""exercise-answer__content dangerous-html"">sugerem uma atmosfera onírica alinhada ao desejo de resgate da espiritualidade.</div>","<div class=""exercise-answer__content dangerous-html"">mimetizam, na paisagem, os corpos transformados pela violência da escravidão.</div>",A,"<div class=""dangerous-html""><p><br></p></div>"
46,ENEM2023LIN43: De quem é esta língua?,48,"<div class=""dangerous-html""><p style=""text-align:center""><strong>De quem é esta língua?</strong><br></p><p></p><div style=""text-align:justify"">&nbsp; &nbsp; Uma pequena editora brasileira, a Urutau, acaba de lançar em Lisboa uma ""antologia antirracista de poetas estrangeiros em Portugal"", com o título Volta para a tua terra.</div><div style=""text-align:justify"">&nbsp; &nbsp; O livro denuncia as diversas formas de racismo a que os imigrantes estão sujeitos. Alguns dos poetas brasileiros antologiados queixam-se do desdém com que um grande número de portugueses acolhe o português brasileiro. É uma queixa frequente.<br><div style=""text-align:justify"">&nbsp;&nbsp;&nbsp;&nbsp;<span style=""text-align:left"">""Aqui em Portugal eles dizem /- eles dizem-/ que nosso português é errado, que nós não falamos português"", escreve a poetisa paulista Maria Giulia Pinheiro, para concluir: ""Se a sua linguagem, a lusitana, / ainda conserva a palavra da opressão / ela não é a mais bonita do mundo./ Ela é uma das mais violentas"".</span></div></div><p></p><p style=""text-align:right""><span>AGUALUSA J. E. Disponível em: https://oglobo.globo.com. Acesso em: 22 nov. 2021 (adaptado).</span></p><p>O texto de Agualusa tematiza o preconceito em relação ao português brasileiro. Com base no trecho citado pelo autor, infere-se que esse preconceito se deve</p></div>","<div class=""exercise-answer__content dangerous-html"">à dificuldade de consolidação da literatura brasileira em outros países.</div>","<div class=""exercise-answer__content dangerous-html"">aos diferentes graus de instrução formal entre os falantes de língua portuguesa.</div>","<div class=""exercise-answer__content dangerous-html"">à existência de uma língua ideal que alguns falantes lusitanos creem ser a falada em Portugal.</div>","<div class=""exercise-answer__content dangerous-html""><div>ao intercâmbio cultural que ocorre entre os povos dos diferentes países de língua portuguesa</div><div><br></div></div>","<div class=""exercise-answer__content dangerous-html"">à distância territorial entre os falantes do português que vivem em Portugal e no Brasil.</div>",C,"<div class=""dangerous-html""><p><br></p></div>"
