,title,order,body,A,B,C,D,E,resposta,resolucao
20,Questão 111 de Ciências da Natureza e suas Tecnologias da prova ENEM/2022: (ENEM 2022)O manual de uma duch,21,"<div><p>(ENEM 2022)</p><p style=""text-align:justify"">O manual de uma ducha elétrica informa que seus três níveis de aquecimento (morno, quente e superquente) apresentam as seguintes variações de temperatura da água em função de sua vazão:</p><p style=""text-align:center""><img src=""https://raw.githubusercontent.com/NiedsonEmanoel/CDN_ENEMASTER/main/EnemasterParts/MjAyMi0xMS0yMCAyMjowNDowNyArMDAwMDg2NTIzNg==.png"" data-filename=""58606""></p><p style=""text-align:justify"">Utiliza-se um disjuntor para proteger o circuito dessa ducha contra sobrecargas elétricas em qualquer nível de aquecimento. Por padrão, o disjuntor é especificado pela corrente nominal igual ao múltiplo de 5 A imediatamente superior à corrente máxima do circuito. Considere que a ducha deve ser ligada em 220 V e que toda a energia é dissipada através da resistência do chuveiro e convertida em energia térmica transferida para a água, que apresenta calor específico de 4,2&nbsp; J/g ºC&nbsp; e densidade de 1 000&nbsp; g/L.</p><p style=""text-align:justify"">O disjuntor adequado para a proteção dessa ducha é especificado por:</p></div>","<div class=""exercise-answer__content dangerous-html""><p>60 A</p></div>","<div class=""exercise-answer__content dangerous-html""><p>30 A</p></div>","<div class=""exercise-answer__content dangerous-html""><p>20 A</p></div>","<div class=""exercise-answer__content dangerous-html""><p>10 A</p></div>","<div class=""exercise-answer__content dangerous-html""><p>5 A</p></div>",B,"<div><p>Da definição de potência e utilizando a informação de que toda energia é dissipada através da resistência do chuveiro e convertida em energia térmica transferida para água, teremos:<br></p><div style=""text-align:center""><br></div><div style=""text-align:center""><img src=""https://raw.githubusercontent.com/NiedsonEmanoel/CDN_ENEMASTER/main/EnemasterParts/MjAyMi0xMS0yMSAwMTo0ODo0OSArMDAwMDM5ODcxNw==.png"" data-filename=""58802""><br><br><div style=""text-align:left"">Onde:</div><div style=""text-align:left"">d → densidade da água<br>V → Volume</div><div style=""text-align:left""><span style=""font-size:1em"">Δt&nbsp;</span><span style=""text-align:center"">→ variação de tempo</span></div><div style=""text-align:left""><span style=""font-size:1em"">c </span>→<span style=""font-size:1em"">&nbsp;calor específico&nbsp;</span></div><div style=""text-align:left""><span style=""font-size:1em"">Δθ&nbsp;</span><span>→ variação de temperatura</span></div><div style=""text-align:left""><span>U&nbsp;</span><span>→ tensão elétrica</span></div><div style=""text-align:left""><span>i&nbsp;</span><span>→ intensidade da corrente elétrica&nbsp;</span></div><div style=""text-align:left""><span><br></span></div><div style=""text-align:left""><span>Para calcularmos o i<sub>max&nbsp;</sub>&nbsp;, devemos usar o nível de maior aquecimento, ou seja, o superquente. Assim sendo, teremos:&nbsp;</span></div><div style=""text-align:left""><span><br></span></div><div style=""text-align:left""><div style=""text-align:center""><img data-filename=""58815"" src=""https://raw.githubusercontent.com/NiedsonEmanoel/CDN_ENEMASTER/main/EnemasterParts/MjAyMi0xMS0yMSAxMjo0MDoyNyArMDAwMDU4NTcxNw==.png""></div><div style=""text-align:center""></div><div style=""text-align:justify"">Logo, de acordo com o critério do texto, escolhemos 30A.&nbsp;</div><div style=""text-align:justify""></div><div style=""text-align:justify""><strong>Resposta correta: B</strong></div><div style=""text-align:justify""><br></div><div style=""text-align:justify""></div></div></div><p></p></div>"
21,Questão 112 de Ciências da Natureza e suas Tecnologias da prova ENEM/2022: (ENEM 2022)Um grupo de alunos r,22,"<div><p>(ENEM 2022)</p><p style=""text-align:justify"">Um grupo de alunos realizou um experimento para observar algumas propriedades dos ácidos, adicionando um pedaço de mármore (CaCO<sub>3</sub>) a uma solução aquosa de ácido clorídrico (HCI), observando a liberação de um gás e o aumento da temperatura.</p><p style=""text-align:center""><img src=""https://raw.githubusercontent.com/NiedsonEmanoel/CDN_ENEMASTER/main/EnemasterParts/MjAyMi0xMS0yMCAyMjoxMDo1OSArMDAwMDYzOTg5MQ==.png"" data-filename=""58621""></p><p>O gás obtido no experimento é o:</p></div>","<div class=""exercise-answer__content dangerous-html""><p>H<sub>2</sub></p></div>","<div class=""exercise-answer__content dangerous-html""><p>O<sub>2</sub></p></div>","<div class=""exercise-answer__content dangerous-html""><p>CO<sub>2</sub></p></div>","<div class=""exercise-answer__content dangerous-html""><p>CO</p></div>","<div class=""exercise-answer__content dangerous-html""><p>CI<sub>2</sub></p></div>",C,"<div><p style=""text-align:justify"">Observe a reação:&nbsp;</p><p style=""text-align:center""><img data-filename=""58816"" src=""https://raw.githubusercontent.com/NiedsonEmanoel/CDN_ENEMASTER/main/EnemasterParts/MjAyMi0xMS0yMSAxMjo0NDo0MiArMDAwMDE1NDYzNg==.png""></p><p style=""text-align:justify"">Como o ácido carbônico é instável, ele se decompõe em água e CO<sub>2</sub></p><p style=""text-align:justify""><strong>Resposta correta: C</strong></p><p style=""text-align:justify""><br></p></div>"
22,"Questão 113 de Ciências da Natureza e suas Tecnologias da prova ENEM/2022: (ENEM 2022)Em 2002, foi publica",23,"<div><p>(ENEM 2022)</p><p style=""text-align:justify"">Em 2002, foi publicado um artigo científico que relacionava alterações na produção de hormônios sexuais de sapos machos expostos à atrazina, um herbicida, com o desenvolvimento anômalo de seus caracteres sexuais primários e secundários. Entre os animais sujeitos à contaminação, observaram-se casos de hermafroditismo e desmasculinização da laringe. O estudo em questão comparou a concentração de um hormônio específico no sangue de machos expostos ao agrotóxico com a de outros machos e fêmeas que não o foram (controles). Os resultados podem ser vistos na figura.</p><p style=""text-align:center""><img src=""https://raw.githubusercontent.com/NiedsonEmanoel/CDN_ENEMASTER/main/EnemasterParts/MjAyMi0xMS0yMCAyMjoxMTo0NSArMDAwMDkyMjc1Ng==.png"" data-filename=""58622""></p><p>Com base nas informações do texto, qual é o hormônio cujas concentrações estão representadas na figura?</p></div>","<div class=""exercise-answer__content dangerous-html""><p>Estrogênio.</p></div>","<div class=""exercise-answer__content dangerous-html""><p>Feromônio.</p></div>","<div class=""exercise-answer__content dangerous-html""><p>Testosterona.</p></div>","<div class=""exercise-answer__content dangerous-html""><p>Somatotrofina.&nbsp;</p></div>","<div class=""exercise-answer__content dangerous-html""><p>Hormônio folículo estimulante.</p></div>",C,"<div class=""dangerous-html""><p>Segundo o texto, a atrazina leva à desmasculinização dos sapos machos, de modo que deve inibir hormônios masculinos, como a testosterona.</p><p>Resolução fornecida em parceria com Colégio Ari de Sá e SAS Plataforma de Educação<br></p></div>"
23,Questão 114 de Ciências da Natureza e suas Tecnologias da prova ENEM/2022: (ENEM 2022)O veneno da cascavel,24,"<div class=""dangerous-html""><p style=""text-align:justify"">(ENEM 2022)</p><p style=""text-align:justify"">O veneno da cascavel pode causar hemorragia com risco de morte a quem é picado pela serpente. No entanto, pesquisadores do Brasil e da Bélgica desenvolveram uma molécula de interesse farmacêutico, a PEG-collineína-1, a partir de uma proteína encontrada no veneno dessa cobra, capaz de modular a coagulação sanguínea. Embora a técnica não seja nova, foi a primeira vez que o método foi usado a partir de uma toxina animal na sua forma recombinante, ou seja, produzida em laboratório por um fungo geneticamente modificado.</p><p style=""text-align:right""><span>JULIÃO, A. <strong>Técnica modifica proteína do veneno de cascavel e permite criar fármaco que modula a coagulação sanguínea</strong>. Disponível em: https://agencia fapesp.br. Acesso em: 22 nov. 2021 (adaptado).</span></p><p>Esse novo medicamento apresenta potencial aplicação para</p></div>","<div class=""exercise-answer__content dangerous-html""><p>impedir a formação de trombos, típicos em alguns casos de acidente vascular cerebral.</p></div>","<div class=""exercise-answer__content dangerous-html""><p>tratar consequências da anemia profunda, em razão da perda de grande volume de sangue.&nbsp;</p></div>","<div class=""exercise-answer__content dangerous-html""><p>evitar a manifestação de urticárias, comumente relacionadas a processos alérgicos.</p></div>","<div class=""exercise-answer__content dangerous-html""><p>reduzir o inchaço dos linfonodos, parte da resposta imunitária de diferentes infecções.</p></div>","<div class=""exercise-answer__content dangerous-html""><p>regular a oscilação da pressão arterial, característica dos quadros de hipertensão.</p></div>",A,"<div class=""dangerous-html""><p>O processo coagulatório caracteriza-se pela conversão fisiológica, em coágulos típicos, do sangue em sua apresentação líquida, contribuindo para a formação de quadros hemorrágicos na interrupção do sangramento. Porém, em condições específicas de formação de coágulos intravasculares, pode haver a ocorrência biológica de tromboses arteriais e venosas. Os componentes de coagulação incluem os elementos plaquetários, os vasos sanguineos bem como os chamados fatores de coagulação. Os processos coagulatórios ocorrem sob duas vias: a intrínseca, que ocorre no interior dos vasos sanguineos; e a extrinseca, quando há, de forma genérica, o extravazamento do sangue dos vasos para os tecidos conjuntivos.</p><p>Dessa forma, os mecanismos coagulatórios envolvem uma sequência de eventos químicos e plaquetários, resultando na for-mação de um coágulo de fibrina que contribui para a hemostasia (cessação do sangramento) e a reparação do tecido danificado.</p><p>Analisando o comando, evidencia-se o desenvolvimento de uma molécula de interesse farmacêutico, a chamada PEG-collineína-1, a partir de um componente proteico encontrado no veneno da cascavel, capaz de modular os processos envolvidos na coagulação sanguinea. Dessa forma, considerando a aplica- bilidade farmacêutica da referida molécula (PEG-collineina-1), o fármaco em questão apresenta potencial aplicação para gerar impedimentos na formação de trombos, eventos típicos, em alguns casos, de acidente vascular cerebral.</p><p><strong>Resposta correta: A</strong></p><p><br></p></div>"
24,Questão 115 de Ciências da Natureza e suas Tecnologias da prova ENEM/2022: (ENEM 2022)Um Buraco Negro é um,25,"<div class=""dangerous-html""><p>(ENEM 2022)</p><p style=""text-align:justify"">Um Buraco Negro é um corpo celeste que possui uma grande quantidade de matéria concentrada em uma pequena região do espaço, de modo que sua força gravitacional é tão grande que qualquer partícula fica aprisionada em sua superfície, inclusive a luz. O raio dessa região caracteriza uma superfície-limite, chamada de horizonte de eventos, da qual nada consegue escapar. Considere que o Sol foi instantaneamente substituído por um Buraco Negro com a mesma massa solar, de modo que o seu horizonte de eventos seja de aproximadamente 3,0 km.</p><p style=""text-align:right""><span>SCHWARZSCHILD, K. <strong>On the Gravitational Field of a Mass Point According to Einstein's Theory</strong>. Disponível em: arxiv.org. Acesso em: 26 maio 2022 (adaptado).</span></p><p>Após a substituição descrita, o que aconteceria aos planetas do Sistema Solar?</p></div>","<div class=""exercise-answer__content dangerous-html""><p>Eles se moveriam em órbitas espirais, aproximando-se sucessivamente do Buraco Negro.</p></div>","<div class=""exercise-answer__content dangerous-html""><p>Eles oscilariam aleatoriamente em torno de suas órbitas elípticas originais.</p></div>","<div class=""exercise-answer__content dangerous-html""><p>Eles se moveriam em direção ao centro do Buraco Negro.</p></div>","<div class=""exercise-answer__content dangerous-html""><p>Eles passariam a precessionar mais rapidamente.</p></div>","<div class=""exercise-answer__content dangerous-html""><p>Eles manteriam suas órbitas inalteradas.</p></div>",E,"<div><p style=""text-align:justify"">De acordo com a Lei da Gravitação Universal, </p><p style=""text-align:center""><img data-size=""1"" data-latex=""F%20=%20%5Cfrac%7BG%5Ccdot%20M%5Ccdot%20m%7D%7Bd%5E2%7D"" src=""https://raw.githubusercontent.com/NiedsonEmanoel/CDN_ENEMASTER/main/EnemasterParts/MjAyMi0xMS0yMSAxMjoyOToxOCArMDAwMDI3NzQ=.png"">,&nbsp;</p><p style=""text-align:justify"">não teremos alteração entre o Sol e os planetas com a substituição do Sol pelo buraco negro. Isso acontece porque:&nbsp;</p><p style=""text-align:justify"">I. A massa do Sol é a mesma do Buraco Negro;</p><p style=""text-align:justify"">II. Os planetas do sistema solar estão fora da região denominada horizonte de eventos, região onde os planetas seriam sugados pelo Buraco Negro. Assim, as orbitas dos planetas não seriam alteradas, de acordo com a terceira lei de Kepler.&nbsp;</p><p style=""text-align:justify""><strong>Resposta correta: E</strong></p><p style=""text-align:justify""><br></p></div>"
25,Questão 116 de Ciências da Natureza e suas Tecnologias da prova ENEM/2022: (ENEM 2022)Durante o ano de 202,26,"<div class=""dangerous-html""><p>(ENEM 2022)</p><p style=""text-align:justify"">Durante o ano de 2020, impulsionado pela necessidade de respostas rápidas e eficientes para desinfectar ambientes de possíveis contaminações com o SARS-CoV-2, causador da covid-19, diversas alternativas foram buscadas para os procedimentos de descontaminação de materiais e ambientes. Entre elas, o uso de ozônio em meio aquoso como agente sanitizante para pulverização em humanos e equipamentos de proteção em câmaras ou túneis, higienização de automóveis e de ambientes fechados e descontaminação de trajes. No entanto, pouca atenção foi dada à toxicidade do ozônio, à formação de subprodutos, ao nível de concentração segura e às precauções necessárias.</p><p style=""text-align:right""><span>LIMA, M. J. A.; FELIX, E. P.; CARDOSO, A. A. Aplicações e implicações do ozônio na indústria, ambiente e saúde. <strong>Química Nova</strong>, n. 9, 2021 (adaptado).</span></p><p style=""text-align:justify"">O grande risco envolvido no emprego indiscriminado dessa substância deve-se à sua ação química como</p></div>","<div class=""exercise-answer__content dangerous-html""><p>catalisador.</p></div>","<div class=""exercise-answer__content dangerous-html""><p>oxidante.</p></div>","<div class=""exercise-answer__content dangerous-html""><p>redutor.</p></div>","<div class=""exercise-answer__content dangerous-html""><p>ácido.</p></div>","<div class=""exercise-answer__content dangerous-html""><p>base.</p></div>",B,"<div class=""dangerous-html""><p style=""text-align:justify""><span style=""font-size:1em"">O gás ozônio (O3) é um poderoso agente oxidante, e precisa ser usado com cuidado, pois não deve ser inalado e pode reagir com moléculas orgânicas presentes no organismo, formando produtos indesejáveis.</span></p><p style=""text-align:justify""><span style=""font-size:1em""><br></span></p><p style=""text-align:justify""><span style=""font-size:1em"">Resposta correta: B</span></p><p style=""text-align:justify""><span style=""font-size:1em""><br></span></p><p style=""text-align:justify""><span style=""font-size:1em""></span></p><p><span><strong><br></strong></span><br></p></div>"
26,Questão 117 de Ciências da Natureza e suas Tecnologias da prova ENEM/2022: (ENEM 2022)Na figura está repre,27,"<div><p style=""text-align:justify"">(ENEM 2022)</p><p style=""text-align:justify"">Na figura está representado o mosaicismo em função da inativação aleatória de um dos cromossomos X, que ocorre em todas as mulheres sem alterações patológicas.</p><p style=""text-align:center""><img src=""https://raw.githubusercontent.com/NiedsonEmanoel/CDN_ENEMASTER/main/EnemasterParts/MjAyMi0xMS0yMCAyMjoxMzo1MiArMDAwMDE2MDY1MA==.png"" data-filename=""58623""></p><p style=""text-align:justify"">Entre mulheres heterozigotas para doenças determinadas por genes recessivos ligados ao sexo, essa inativação tem como consequência a ocorrência de</p></div>","<div class=""exercise-answer__content dangerous-html""><p>pleitropia.</p></div>","<div class=""exercise-answer__content dangerous-html""><p>mutação gênica.</p></div>","<div class=""exercise-answer__content dangerous-html""><p>interação gênica.</p></div>","<div class=""exercise-answer__content dangerous-html""><p>penetrância incompleta.</p></div>","<div class=""exercise-answer__content dangerous-html""><p>expressividade variável.</p></div>",E,"<div class=""dangerous-html""><p>Nos mamíferos, inclusive na espécie humana, a determinação genética do sexo é do tipo XY. Desse modo, indivíduos do sexo masculino têm cromossomos sexuais e indivíduos do sexo feminino têm cromossomos XX. Nas fêmeas de mamíferos, um dos cromossomos X está inativado na forma de heterocromatina, formando uma estrutura denominada cromatina sexual ou corpúsculo de Barr. A hipótese mais aceita para justificar essa inativação é a Hipótese de Lyon ou do Mecanismo de Compensação de Dose, segundo a qual um dos cromossomos X da mulher é inativado para evitar a produção excessiva de substâncias codificadas por genes do cromossomo X, o que seria prejudicial de alguma forma. Assim, em mulheres heterozigotas para genes no cromossomo X, por exemplo, XDXd, onde D não determina uma doença e d determina uma doença, há inativação de um dos cromossomos X, o que ocorre de modo aleatório Assim, em algumas partes do corpo, inativa o cromossomo X do alelo D, ficando ativo o cromossomo X do alelo d. de modo que essa parte do corpo pode manifestar a doença, já em outras partes do corpo, inativa o cromossomo X do alelo d, ficando ativa o cromossomo X do alelo D, de modo que essa parte do corpo pode não manifestar a doença. Como a inativação do cromossomo X extra é aleatória, as partes do corpo com alelo D e d, ou seja, que manifestam e que não manifestam a doença, são bem variáveis, de modo que a intensidade de manifestação da doença, ou seja a expressividade, pode ser muito variável.</p><p>Observação: Penetrância gênica é a “percentagem real” com que um gene se manifesta no total dos indivíduos em que teoricamente, esse gene deveria se manifestar. A observação prática demonstra que a manifestação gênica nem sempre corresponde, estatisticamente, ao que era de esperar.</p><div>Resolução fornecida em parceria com Colégio Ari de Sá e SAS Plataforma de Educação<br></div></div>"
27,Questão 118 de Ciências da Natureza e suas Tecnologias da prova ENEM/2022: (ENEM 2022)O físico Hans C. Oer,28,"<div><p>(ENEM 2022)</p><p style=""text-align:justify"">O físico Hans C. Oersted observou que um fio transportando corrente elétrica produz um campo magnético. A presença do campo magnético foi verificada ao aproximar uma bússola de um fio conduzindo corrente elétrica. A figura ilustra um fio percorrido por uma corrente elétrica<i> i,</i> constante e com sentido para cima. Os pontos <strong>A</strong>,<strong> B </strong>e<strong> C</strong> estão num plano transversal e equidistantes do fio. Em cada ponto foi colocada uma bússola.</p><p style=""text-align:center""><img src=""https://raw.githubusercontent.com/NiedsonEmanoel/CDN_ENEMASTER/main/EnemasterParts/MjAyMi0xMS0yMCAyMjoxNDozNiArMDAwMDc2MzIzMw==.png"" data-filename=""58625""></p><p style=""text-align:justify"">Considerando apenas o campo magnético por causa da corrente<i> i</i>, as respectivas configurações das bússolas nos pontos <strong>A</strong>,<strong> B</strong> e <strong>C</strong> serão</p></div>","<div class=""exercise-answer__content dangerous-html""><p style=""text-align:left""><img src=""https://raw.githubusercontent.com/NiedsonEmanoel/CDN_ENEMASTER/main/EnemasterParts/MjAyMi0xMS0yMCAyMjoxNDo0NCArMDAwMDgzNTQ4NQ==.png"" data-filename=""58627""><br></p></div>","<div class=""exercise-answer__content dangerous-html""><p style=""text-align:left""><img src=""https://raw.githubusercontent.com/NiedsonEmanoel/CDN_ENEMASTER/main/EnemasterParts/MjAyMi0xMS0yMCAyMjoxNDo0OSArMDAwMDkzNDQwNw==.png"" data-filename=""58628""><br></p></div>","<div class=""exercise-answer__content dangerous-html""><p style=""text-align:left""><img src=""https://raw.githubusercontent.com/NiedsonEmanoel/CDN_ENEMASTER/main/EnemasterParts/MjAyMi0xMS0yMCAyMjoxNDo1NSArMDAwMDI0Njg2Mg==.png"" data-filename=""58629""><br></p></div>","<div class=""exercise-answer__content dangerous-html""><p style=""text-align:left""><img src=""https://raw.githubusercontent.com/NiedsonEmanoel/CDN_ENEMASTER/main/EnemasterParts/MjAyMi0xMS0yMCAyMjoxNTowMSArMDAwMDk0MjE3MA==.png"" data-filename=""58630""><br></p></div>","<div class=""exercise-answer__content dangerous-html""><p style=""text-align:left""><img src=""https://raw.githubusercontent.com/NiedsonEmanoel/CDN_ENEMASTER/main/EnemasterParts/MjAyMi0xMS0yMCAyMjoxNTowNyArMDAwMDE1OTYyNg==.png"" data-filename=""58631""><br></p></div>",D,"<div><p>Aplicando a regra da mão direita, onde a ponta dos dedos representa o campo magnético, e o polegar, a corrente elétrica, teremos o campo de acordo com a figura acima. A bússola terá o seu norte apontando de acordo com a linha de indução do campo.</p><div><br><div style=""text-align:center""><img src=""https://raw.githubusercontent.com/NiedsonEmanoel/CDN_ENEMASTER/main/EnemasterParts/MjAyMi0xMS0yMSAwMToxNjo1NyArMDAwMDE1MTg4NA==.png"" data-filename=""58779""></div><div style=""text-align:center""><strong><br></strong></div><div style=""text-align:left""><strong>Resposta correta: D</strong></div><div style=""text-align:left""><br></div><div style=""text-align:left""><br></div><div style=""text-align:left""><br></div></div></div>"
