,title,order,body,A,B,C,D,E,resposta,resolucao
28,Questão 119 de Ciências da Natureza e suas Tecnologias da prova ENEM/2022: (ENEM 2022)O quadro mostra valo,29,"<div><p>(ENEM 2022)</p><p>O quadro mostra valores de corrente elétrica e seus efeitos sobre o corpo humano.</p><p style=""text-align:center""><img data-filename=""58642"" src=""https://raw.githubusercontent.com/NiedsonEmanoel/CDN_ENEMASTER/main/EnemasterParts/MjAyMi0xMS0yMCAyMjoxODo1MCArMDAwMDUyODk=.png""><br></p><p style=""text-align:justify"">A corrente elétrica que percorrerá o corpo de um indivíduo depende da tensão aplicada e da resistência elétrica média do corpo humano. Esse último fator está intimamente relacionado com a umidade da pele, que seca apresenta resistência elétrica da ordem de 500 kΩ, mas, se molhada, pode chegar a apenas 1 kΩ.</p><p style=""text-align:justify"">Apesar de incomum, é possível sofrer um acidente utilizando baterias de 12 V. Considere que um indivíduo com a pele molhada sofreu uma parada respiratória ao tocar simultaneamente nos pontos A e B de uma associação de duas dessas baterias.</p><p style=""text-align:right""><span>DURAN, J. E. R. <strong>Biofísica: fundamentos e aplicações</strong>. São Paulo: Pearson Prentice Hall, 2003 (adaptado).</span></p><p>Qual associação de baterias foi responsável pelo acidente?</p></div>","<div class=""exercise-answer__content dangerous-html""><p style=""text-align:left""><img src=""https://raw.githubusercontent.com/NiedsonEmanoel/CDN_ENEMASTER/main/EnemasterParts/MjAyMi0xMS0yMCAyMjoyMDo0NCArMDAwMDE4MTQ0Ng==.png"" data-filename=""58643""><br></p></div>","<div class=""exercise-answer__content dangerous-html""><p style=""text-align:left""><img src=""https://raw.githubusercontent.com/NiedsonEmanoel/CDN_ENEMASTER/main/EnemasterParts/MjAyMi0xMS0yMCAyMjoyMDo1MiArMDAwMDMyNzEyNw==.png"" data-filename=""58644""><br></p></div>","<div class=""exercise-answer__content dangerous-html""><p style=""text-align:left""><img src=""https://raw.githubusercontent.com/NiedsonEmanoel/CDN_ENEMASTER/main/EnemasterParts/MjAyMi0xMS0yMCAyMjoyMToxNSArMDAwMDI5NzI3MA==.png"" data-filename=""58645""><br></p></div>","<div class=""exercise-answer__content dangerous-html""><p style=""text-align:left""><img src=""https://raw.githubusercontent.com/NiedsonEmanoel/CDN_ENEMASTER/main/EnemasterParts/MjAyMi0xMS0yMCAyMjoyMToyNiArMDAwMDg1NTA4MQ==.png"" data-filename=""58646""><br></p></div>","<div class=""exercise-answer__content dangerous-html""><p style=""text-align:left""><img src=""https://raw.githubusercontent.com/NiedsonEmanoel/CDN_ENEMASTER/main/EnemasterParts/MjAyMi0xMS0yMCAyMjoyMTozNSArMDAwMDEwNzI1OA==.png"" data-filename=""58647""><br></p></div>",A,"<div><p>I. A questão destacou que a pessoa encontra-se molhada. Logo, a resistência é de R= 1<span style=""font-size:1em"">k</span><span style=""font-size:1em"">𝞨</span></p><p>II. A pessoa sofre parada respiratória. Logo, a corrente deve estar compreendida entre 20 mA e 100 mA.</p><p>III. A questão mostra que usaremos duas baterias de 12 V cada uma. Usando duas baterias em série, teremos a d.d.p. total sendo 24 V.</p><p><img src=""https://raw.githubusercontent.com/NiedsonEmanoel/CDN_ENEMASTER/main/EnemasterParts/MjAyMi0xMS0yMSAwMTo0NTozNiArMDAwMDcyMzQ0OA==.png"" data-filename=""58797""><br></p><p>Aplicando a 1ª lei de OHM, teremos:</p><p><img src=""https://raw.githubusercontent.com/NiedsonEmanoel/CDN_ENEMASTER/main/EnemasterParts/MjAyMi0xMS0yMSAwMTo0NTo0OSArMDAwMDE5Mzc5Mw==.png"" data-filename=""58798""><br></p><p><strong>Obs.:</strong> em geradores em série, o polo positivo de um gerador é ligado ao polo negativo do outro gerador, como mostra o item A.</p><p>Resolução fornecida em parceria com Colégio Ari de Sá e SAS Plataforma de Educação<br></p></div>"
29,Questão 120 de Ciências da Natureza e suas Tecnologias da prova ENEM/2022: (ENEM 2022)O urânio é empregado,30,"<div class=""dangerous-html""><p>(ENEM 2022)</p><p style=""text-align:justify"">O urânio é empregado como fonte de energia em reatores nucleares. Para tanto, o seu mineral deve ser refinado, convertido a hexafluoreto de urânio e posteriormente enriquecido, para aumentar de 0,7% a 3% a abundância de um isótopo específico - o urânio-235. Uma das formas de enriquecimento utiliza a pequena diferença de massa entre os hexafluoretos de urânio-235 e de urânio-238 para separá-los por efusão, precedida pela vaporização. Esses vapores devem efundir repetidamente milhares de vezes através de barreiras porosas formadas por telas com grande número de pequenos orifícios. No entanto, devido à complexidade e à grande quantidade de energia envolvida, cientistas e engenheiros continuam a pesquisar procedimentos alternativos de enriquecimento.</p><p style=""text-align:right""><span>ATKINS, P.; JONES, L. Princípios de química: questionando a vida moderna e o meio ambiente. Porto Alegre: Bookman, 2006 (adaptado).</span></p><p>Considerando a diferença de massa mencionada entre os dois isótopos, que tipo de procedimento alternativo ao da efusão pode ser empregado para tal finalidade?</p></div>","<div class=""exercise-answer__content dangerous-html""><p>Peneiração.</p></div>","<div class=""exercise-answer__content dangerous-html""><p>Centrifugação.</p></div>","<div class=""exercise-answer__content dangerous-html""><p>Extração por solvente.</p></div>","<div class=""exercise-answer__content dangerous-html""><p>Destilação fracionada.</p></div>","<div class=""exercise-answer__content dangerous-html""><p>Separação magnética.</p></div>",B,"<div><p>Considerando o texto e a diferença das massas entre os isótopos, um método alternativo para o enriquecimento do urânio é a centrifugação, onde as moléculas mais pesadas</p><p><img data-size=""1"" data-latex=""%5Cbigg(%5E%7B238%7DU%5Cbigg)"" src=""https://raw.githubusercontent.com/NiedsonEmanoel/CDN_ENEMASTER/main/EnemasterParts/MjAyMi0xMS0yMCAyMzo1NzozNyArMDAwMDU1NzE5Mw==.png"">&nbsp; são jogadas para as bordas da centrifuga, sendo separadas das moléculas que possuem urânio mais leve&nbsp;<img src=""https://raw.githubusercontent.com/NiedsonEmanoel/CDN_ENEMASTER/main/EnemasterParts/MjAyMi0xMS0yMCAyMzo1NzozNyArMDAwMDcxMTUzMQ==.png"" data-latex=""%5Cbigg(%5E%7B235%7DU%5Cbigg)"" data-size=""1"">.</p><p><strong>Resposta correta: B</strong><br><br><br></p><br></div>"
30,Questão 121 de Ciências da Natureza e suas Tecnologias da prova ENEM/2022: (ENEM 2022)A Agência Nacional d,31,"<div class=""dangerous-html""><p>(ENEM 2022)</p><p style=""text-align:justify"">A Agência Nacional de Vigilância Sanitária (Anvisa) aprovou um produto de terapia gênica no país, indicado para o tratamento da distrofia hereditária da retina. O procedimento é recomendado para crianças acima de 12 meses e adultos com perda de visão causada pela mutação do gene humano RPE65. O produto, elaborado por engenharia genética, é composto por um vírus, no qual foi inserida uma cópia do gene normal humano RPE65 para corrigir o funcionamento das células da retina.</p><p style=""text-align:right""><span>ANVISA. Disponível em: www.gov.br/anvisa. Acesso em: 4 dez. 2021 (adaptado)</span></p><div style=""text-align:justify"">O sucesso dessa terapia advém do fato de que o produto favorecerá a<br></div></div>","<div class=""exercise-answer__content dangerous-html""><p>correção do código genético para a tradução da proteína.<br></p></div>","<div class=""exercise-answer__content dangerous-html""><p>alteração do RNA ribossômico ligado à síntese da proteína.<br></p></div>","<div class=""exercise-answer__content dangerous-html""><p>produção de mutações benéficas para a correção do problema.<br></p></div>","<div class=""exercise-answer__content dangerous-html""><p>liberação imediata da proteína normal na região ocular humana.<br></p></div>","<div class=""exercise-answer__content dangerous-html""><p>expressão do gene responsável pela produção da enzima normal.<br></p></div>",E,"<div class=""dangerous-html""><p>A terapia gênica consiste no tratamento de doenças genéticas pela introdução de genes saudáveis para compensar a existência de genes defeituosos no doente. No caso, o vírus foi usado como vetor para a introdução do gene responsável pela correção da doença. Genes são trechos de DNA com informação para a produção de um RNA, como RNAM, que é traduzido em proteínas, que podem ser enzimas, como no caso da questão.</p><p>Observação: O código genético consiste na relação entre os nucleotideos (bases nitrogenadas) no RNAm e os aminoácidos por eles codificados no peptidio a ser traduzido pelo ribossomo. Cada 3 bases nitrogenadas no RNA mensageiro (RNAM) constituem uma unidade denominada codon que, uma vez traduzida, codifica um certo aminoácido no peptidio. Assim, a terapia gênica corrige defeitos no DNA, mas não altera ou corrige o código genético do indivíduo.</p><p><strong>Resposta correta: E</strong></p><p><br></p></div>"
31,Questão 122 de Ciências da Natureza e suas Tecnologias da prova ENEM/2022: (ENEM 2022)A figura ilustra esq,32,"<div><p>(ENEM 2022)</p><p style=""text-align:justify"">A figura ilustra esquematicamente um processo de remediação de solos contaminados com tricloroeteno (TCE), um agente desengraxante. Em razão de vazamentos de tanques de estocagem ou de manejo inapropriado de resíduos industriais, ele se encontra presente em águas subterrâneas, nas quais forma uma fase líquida densa não aquosa (DNAPL) que se deposita no fundo do aquífero. Essa tecnologia de descontaminação emprega o íon persulfato (S<sub>2</sub>O<sub>8</sub><sup>2-</sup>), que é convertido no radical •SO<sub>4&nbsp; </sub>— por minerais que contêm Fe(III). O esquema representa de forma simplificada o mecanismo de ação química sobre o TCE e a formação dos produtos de degradação.&nbsp;Esse procedimento de remediação de águas subterrâneas baseia-se em reações de</p><p style=""text-align:center""><img src=""https://raw.githubusercontent.com/NiedsonEmanoel/CDN_ENEMASTER/main/EnemasterParts/MjAyMi0xMS0yMCAyMjoyODo1NiArMDAwMDk2ODgyMg==.png"" data-filename=""58662""></p><p style=""text-align:justify""><span style=""font-size:1em;text-align:left"">Esse procedimento de remediação de águas subterrâneas baseia-se em reações de</span><br></p><p></p></div>","<div class=""exercise-answer__content dangerous-html""><p>oxirredução.</p></div>","<div class=""exercise-answer__content dangerous-html""><p>substituição.<br></p></div>","<div class=""exercise-answer__content dangerous-html""><p>precipitação.<br></p></div>","<div class=""exercise-answer__content dangerous-html""><p>desidratação.</p></div>","<div class=""exercise-answer__content dangerous-html""><p>neutralização.<br></p></div>",A,"<div><p style=""text-align:justify"">O esquema mostra que o radical&nbsp;<span style=""text-align:justify"">•</span>SO<sub>4</sub>- faz as transformações descritas a seguir com os números de oxidação respectivos.</p><p style=""text-align:center""><img data-filename=""58736"" src=""https://raw.githubusercontent.com/NiedsonEmanoel/CDN_ENEMASTER/main/EnemasterParts/MjAyMi0xMS0yMSAwMDowMzo0NiArMDAwMDMzOTUzMQ==.png""></p><p style=""text-align:justify"">Todas as variações de nox caracterizam processos de oxirredução.</p><p style=""text-align:justify""><strong>Resposta correta: A</strong><br><br><br></p></div>"
32,Questão 123 de Ciências da Natureza e suas Tecnologias da prova ENEM/2022: (ENEM 2022) De acordo com a Org,33,"<div class=""dangerous-html""><p>(ENEM 2022) </p><p style=""text-align:justify"">De acordo com a Organização Mundial da Saúde, a filariose e a leishmaniose são consideradas doenças tropicais infecciosas e constituem uma preocupação para a saúde pública por ser alto o índice de mortalidade a elas associado.</p><div><div>Uma medida profilática comum a essas duas doenças é o(a)</div></div></div>","<div class=""exercise-answer__content dangerous-html""><p>incineração do lixo orgânico.<br></p></div>","<div class=""exercise-answer__content dangerous-html""><p>construção de rede de esgoto.</p></div>","<div class=""exercise-answer__content dangerous-html""><p>uso de vermífugo pela população.</p></div>","<div class=""exercise-answer__content dangerous-html""><p>controle das populações dos vetores.<br></p></div>","<div class=""exercise-answer__content dangerous-html""><p>consumo de carnes vermelhas bem cozidas.<br></p></div>",D,"<div class=""dangerous-html""><p>A filariose ou elefantíase é uma doença causada por um verme nematódeo denominado de Wuchereria bancrofti, sendo transmitido pela picada do mosquito de gênero Culex quiquefasciatus (muriçoca ou pernilongo). Este verme se aloja no sistema linfático, provocando obstrução dos vasos e gerando um extravasamento da linfa.</p><p>A leishmaniose é uma doença causada por protozoário e transmitida por um inseto conhecido como mosquito-palha (Lutzomyia longipalpis), independente da leishmaniose ser calazar ou ferida brava, ambas as doenças são transmitidas pelo mesmo vetor.</p><p>As duas doenças citadas na questão apresentam como vetor um mosquito. Sendo assim, é fundamental o controle da população desses insetos para diminuir a incidência dessas doenças. Vale ressaltar que é fundamental o tratamento das pessoas doentes como medida profilática.</p><p><strong>Resposta correta: D</strong></p><p><br></p></div>"
33,"Questão 124 de Ciências da Natureza e suas Tecnologias da prova ENEM/2022: (ENEM 2022) Em 2017, foi inaugu",34,"<div><p>(ENEM 2022) </p><p style=""text-align:justify"">Em 2017, foi inaugurado, no estado da Bahia, o Parque Solar Lapa, composto por duas usinas (Bom Jesus da Lapa e Lapa) e capaz de gerar cerca de 300 GWh de energia por ano. Considere que cada usina apresente potência igual a 75 MW, com o parque totalizando uma potência instalada de 150 MW. Considere ainda que a irradiância solar média é de 1 500&nbsp;<img src=""https://raw.githubusercontent.com/NiedsonEmanoel/CDN_ENEMASTER/main/EnemasterParts/MjAyMi0xMS0yMCAyMToxNzoyNiArMDAwMDg1NDMzNQ==.png"" data-latex=""%5Cfrac%20W%20%7Bm%C2%B2%7D"" data-size=""0.6"">&nbsp; e que a eficiência dos painéis é de 20%.&nbsp;</p><p style=""text-align:right""><span><strong>Parque Solar Lapa entra em operação</strong>. Disponível em: www.canalbioenergia.com.br. Acesso em: 9 jun. 2022 (adaptado).</span><br></p><div><div style=""text-align:justify"">Nessas condições, a área total dos painéis solares que compõem o Parque Solar Lapa é mais próxima de:</div></div></div>","<div class=""exercise-answer__content dangerous-html""><p>1 000 000 m<sup>2</sup><br></p></div>","<div class=""exercise-answer__content dangerous-html""><p>500 000 m<sup>2</sup><br></p></div>","<div class=""exercise-answer__content dangerous-html""><p>250 000 m<sup>2</sup></p></div>","<div class=""exercise-answer__content dangerous-html""><p>100 000 m<sup>2</sup><br></p></div>","<div class=""exercise-answer__content dangerous-html""><p>20 000 m<sup>2</sup><br></p></div>",B,"<div><p>Se as duas usinas têm uma potência instalada de 150 MW e o rendimento é de apenas 25%, temos:</p><p style=""text-align:center""><img data-filename=""58793"" src=""https://raw.githubusercontent.com/NiedsonEmanoel/CDN_ENEMASTER/main/EnemasterParts/MjAyMi0xMS0yMSAwMTozOToyMCArMDAwMDcwODcy.png""></p><p style=""text-align:justify"">A irradiância solar é de 1500 W/m<sup>2</sup>, portanto:&nbsp;</p><p style=""text-align:center""><img data-filename=""58794"" src=""https://raw.githubusercontent.com/NiedsonEmanoel/CDN_ENEMASTER/main/EnemasterParts/MjAyMi0xMS0yMSAwMTo0MDoyOSArMDAwMDQwNzE=.png""></p><p style=""text-align:justify""><br></p><p style=""text-align:justify""><br></p></div>"
34,Questão 125 de Ciências da Natureza e suas Tecnologias da prova ENEM/2022: (ENEM 2022)Os riscos apresentad,35,"<div><p>(ENEM 2022)</p><p style=""text-align:justify"">Os riscos apresentados pelos produtos dependem de suas propriedades e da reatividade quando em contato com outras substâncias. Para prevenir os riscos devido à natureza química dos produtos, devemos conhecer a lista de substâncias incompatíveis e de uso cotidiano em fábricas, hospitais e laboratórios, a fim de observar cuidados na estocagem, manipulação e descarte. O quadro elenca algumas dessas incompatibilidades, que podem levar à ocorrência de acidentes.</p><div style=""text-align:center""><img src=""https://raw.githubusercontent.com/NiedsonEmanoel/CDN_ENEMASTER/main/EnemasterParts/MjAyMi0xMS0yMCAyMjozMDoyNyArMDAwMDcxODA5OQ==.png"" data-filename=""58669""></div><div style=""text-align:center""><br></div><div>Considere que houve o descarte indevido de dois conjuntos de substâncias:</div><div><br></div><div>(1) ácido clorídrico concentrado com cianeto de potássio;</div><div>(2) ácido nítrico concentrado com sacarose.</div><div><div style=""text-align:right""><span>Disponível em: www.fiocruz.br. Acesso em: 6 dez 2017 (adaptado).</span></div></div><div><div>O descarte dos conjuntos (1) e (2) resultará, respectivamente, em</div></div></div>","<div class=""exercise-answer__content dangerous-html""><p>liberação de gás tóxico e reação oxidativa forte.</p></div>","<div class=""exercise-answer__content dangerous-html""><p>reação oxidativa forte e liberação de gás tóxico.<br></p></div>","<div class=""exercise-answer__content dangerous-html""><p>formação de sais tóxicos e reação oxidativa forte.<br></p></div>","<div class=""exercise-answer__content dangerous-html""><p>liberação de gás tóxico e liberação de gás oxidante.<br></p></div>","<div class=""exercise-answer__content dangerous-html""><p>formação de sais tóxicos e liberação de gás oxidante.<br></p></div>",A,"<div><p>(1) O descarte do ácido clorídrico concentrado(HCl) com o cianeto(KCN) promove a reação</p><p style=""text-align:center""><img src=""https://raw.githubusercontent.com/NiedsonEmanoel/CDN_ENEMASTER/main/EnemasterParts/MjAyMi0xMS0yMSAwMDo1NjoyNiArMDAwMDI2ODM4.png"" data-filename=""58766""></p><p style=""text-align:justify"">O produto HCN<sub>(g)</sub>&nbsp;formado é um gás almtamente tóxico e asfixiante.</p><p style=""text-align:justify"">(2) O ácido nítrico concentrado é um forte agente oxidante que, ao reagir com a matéria orgânica carbohidrática (sacarose) promove a formação do gás tóxico NO<sub>2</sub>. A provável reação oxidativa forte que ocorre é:&nbsp;</p><p style=""text-align:justify"">Ácido nítrico + Sacarose&nbsp;→ Ácido oxálico + NO<sub>2&nbsp;</sub>+ H<sub>2</sub>O</p><p style=""text-align:justify""><br></p><p style=""text-align:justify""><br></p></div>"
35,Questão 126 de Ciências da Natureza e suas Tecnologias da prova ENEM/2022: (ENEM 2022)Um pai faz um balanç,36,"<div class=""dangerous-html""><p>(ENEM 2022)</p><p style=""text-align:justify"">Um pai faz um balanço utilizando dois segmentos paralelos e iguais da mesma corda para fixar uma tábua a uma barra horizontal. Por segurança, opta por um tipo de corda cuja tensão de ruptura seja 25% superior à tensão máxima calculada nas seguintes condições:<br></p><p style=""text-align:justify"">• O ângulo máximo atingido pelo balanço em relação à vertical é igual a 90°;<br></p><p style=""text-align:justify"">• Os filhos utilizarão o balanço até que tenham uma massa de 24 kg.</p><p style=""text-align:justify"">Além disso, ele aproxima o movimento do balanço para o movimento circular uniforme, considera que a m aceleração da gravidade é igual a 10 m/s²&nbsp;e despreza forças dissipativas.</p><p style=""text-align:justify"">Qual é a tensão de ruptura da corda escolhida?</p></div>","<div class=""exercise-answer__content dangerous-html""><p>120 N<br></p></div>","<div class=""exercise-answer__content dangerous-html""><p>300 N&nbsp;<br></p></div>","<div class=""exercise-answer__content dangerous-html""><p>360 N<br></p></div>","<div class=""exercise-answer__content dangerous-html""><p>450 N<br></p></div>","<div class=""exercise-answer__content dangerous-html""><p>900 N</p></div>",D,"<div><p><img data-filename=""58801"" src=""https://raw.githubusercontent.com/NiedsonEmanoel/CDN_ENEMASTER/main/EnemasterParts/MjAyMi0xMS0yMSAwMTo0NjoyMiArMDAwMDI2NjY0OQ==.jpeg""></p><p>Conservação de energia: <img data-size=""1"" data-latex=""E_%7BM_A%7D%20=%20E_%7BM_B%7D"" src=""https://raw.githubusercontent.com/NiedsonEmanoel/CDN_ENEMASTER/main/EnemasterParts/MjAyMi0xMS0yMSAwMTo1ODozMCArMDAwMDc0MjMyNg==.png""></p><p><img data-filename=""58807"" src=""https://raw.githubusercontent.com/NiedsonEmanoel/CDN_ENEMASTER/main/EnemasterParts/MjAyMi0xMS0yMSAwMTo1NDo1MCArMDAwMDgyMTU5OA==.jpeg""></p><p>Força centrípeta no ponto B:</p><p><img data-filename=""58810"" src=""https://raw.githubusercontent.com/NiedsonEmanoel/CDN_ENEMASTER/main/EnemasterParts/MjAyMi0xMS0yMSAwMTo1NjoxMyArMDAwMDI5MTM0Mw==.jpeg""></p><p>Valor considerado: 1,25 x 360 = 450 N</p><p>2T = 720<span>&nbsp;➔ </span>T = 360</p><p><strong>Resposta correta: D</strong></p><p></p></div>"
36,Questão 127 de Ciências da Natureza e suas Tecnologias da prova ENEM/2022: (ENEM 2022)A nanotecnologia é r,37,"<div class=""dangerous-html""><div>(ENEM 2022)<br><br><div style=""text-align:justify"">A nanotecnologia é responsável pelo aprimoramento de diversos materiais, incluindo os que são impactados com a presença de poluentes e da umidade na atmosfera, causadores de corrosão. O processo de corrosão é espontâneo e provoca a deterioração de metais como o ferro, que, em presença de oxigênio e água, sofre oxidação, conforme ilustra a equação química:</div></div><div style=""text-align:justify""><br></div><div style=""text-align:justify"">4 Fe (s) + 2 H₂O (I) + 3 O₂ (g) → 2 Fe₂ O₂&nbsp;<span>•</span>H₂O (s)</div><div style=""text-align:justify""><br></div><div style=""text-align:justify"">Uma forma de garantir a durabilidade da estrutura metálica e a sua resistência à umidade consiste na deposição de filmes finos nanocerâmicos à base de zircônia (ZrO2) e alumina (Al2O3) sobre a superfície do objeto que se deseja proteger.</div><div><br></div><div style=""text-align:right""><span>CLEMENTE, G. A. B. F. et al. O uso de materiais hibridos ou nanocompósitos como revestimentos anticorrosivos do aço. <strong>Química Nova</strong>, n. 9, 2021 (adaptado).</span></div><div><br></div><div>Essa nanotecnologia aplicada na proteção contra a corrosão se baseia no(a)</div></div>","<div class=""exercise-answer__content dangerous-html"">proteção catódica, que utiliza um metal fortemente redutor.&nbsp;</div>","<div class=""exercise-answer__content dangerous-html"">uso de metais de sacrifício, que se oxidam no lugar do ferro.</div>","<div class=""exercise-answer__content dangerous-html"">passivação do ferro, que fica revestido pelo seu próprio óxido.</div>","<div class=""exercise-answer__content dangerous-html"">efeito de barreira, que impede o contato com o agente oxidante.</div>","<div class=""exercise-answer__content dangerous-html"">galvanização, que usa outros metais de menor potencial de redução.</div>",D,"<div><p style=""text-align:justify"">O processo de proteção contra corrosão citado na questão, consiste em depositar uma camada fina de zircônia (ZrO<sub>2</sub>) e alumina (Al<sub>2</sub>O<sub>3</sub>) sobre um objeto de ferro, de acordo com o desenho a seguir:&nbsp;</p><p style=""text-align:center""><img data-filename=""58747"" src=""https://raw.githubusercontent.com/NiedsonEmanoel/CDN_ENEMASTER/main/EnemasterParts/MjAyMi0xMS0yMSAwMDozNzo1MCArMDAwMDUyMzIxNw==.png""></p><p style=""text-align:left"">A camada que reveste o metal atua como barreira que impede o contato do ferro (interno) com o oxigênio do ar, que seria o oxidante, evitando o processo corrosivo.</p><p style=""text-align:left""><span style=""font-size:1em""></span><br></p></div>"
